{
  "topic": "最近三个月发布的新款新能源车",
  "focus_terms": "续航, 智能驾驶, 落地价",
  "goal": "给家里换一台新能源车做决策依据:搞清楚最近三个月上市的新车各自的核心卖点、真实续航和落地价,输出一份可以直接拿去对比的材料。",
  "background": "家里现有一台燃油车,预算 15-35 万,以市区通勤为主、偶尔跑长途。看过几篇自媒体文章,但口径互相矛盾,想要一份有出处的整理。",
  "expected_words": 3000,
  "max_sources": 30,
  "time_budget_minutes": 60,
  "focus_items": 8,
  "fetch_timeout_seconds": 90,
  "relevance_floor": 0.35,
  "dedup_similarity": 0.85,
  "depth_level": 2,
  "source_authority": 3,
  "freshness_weight": 60,
  "publish_age_days": [7, 90],
  "price_range": [150000, 350000],
  "confidence_band": [0.6, 0.95],
  "market": "中国大陆",
  "report_language": "中文",
  "report_style": "标准版(5-10 页,含证据链)",
  "urgency": 2,
  "include_charts": true,
  "include_competitor_pricing": true,
  "accent_color": "#2563eb",
  "brand_hex": "#0F172A",
  "run_mode": "单次调研",
  "source_types": ["官方发布", "权威媒体", "行业报告"],
  "delivery": { "kind": "html", "open_after_done": true },
  "watchlist": [
    { "name": "比亚迪", "kind": "品牌", "url": "https://www.byd.com" }
  ],
  "labels": { "项目": "2026 选型", "负责人": "产品组" }
}
